{
  "$schema": "https://json-schema.org/draft/2020-12/schema",
  "$id": "https://raw.githubusercontent.com/api-evangelist/wordnik/refs/heads/main/json-schema/wordnik-definition-schema.json",
  "title": "Definition",
  "description": "Definition schema from Wordnik",
  "type": "object",
  "properties": {
    "attributionText": {
      "type": "string"
    },
    "attributionUrl": {
      "type": "string"
    },
    "citations": {
      "type": "array",
      "items": {
        "$ref": "#/components/schemas/Citation"
      }
    },
    "exampleUses": {
      "type": "array",
      "items": {
        "$ref": "#/components/schemas/ExampleUsage"
      }
    },
    "extendedText": {
      "type": "string"
    },
    "labels": {
      "type": "array",
      "items": {
        "$ref": "#/components/schemas/Label"
      }
    },
    "notes": {
      "type": "array",
      "items": {
        "$ref": "#/components/schemas/Note"
      }
    },
    "partOfSpeech": {
      "type": "string"
    },
    "relatedWords": {
      "type": "array",
      "items": {
        "$ref": "#/components/schemas/Related"
      }
    },
    "score": {
      "type": "number",
      "format": "float"
    },
    "seqString": {
      "type": "string"
    },
    "sequence": {
      "type": "string"
    },
    "sourceDictionary": {
      "type": "string",
      "example": "ahd-5"
    },
    "text": {
      "type": "string"
    },
    "textProns": {
      "type": "array",
      "items": {
        "$ref": "#/components/schemas/TextPron"
      }
    },
    "word": {
      "type": "string"
    }
  }
}